{
  "$schema": "../schema/catalog-entry.v1.schema.json",
  "id": "org.marginalia.examples.dark-mode",
  "name": "Dark Mode",
  "version": "0.1.3",
  "kind": "theme",
  "execution": "module",
  "channel": "experimental",
  "summary": "An OS-wide inverted screen theme for Marginalia",
  "author": "Marginalia",
  "homepage": "https://github.com/marginalia-os/marginalia-examples/tree/main/dark-mode-theme",
  "source": {
    "type": "git",
    "url": "https://github.com/marginalia-os/marginalia-examples.git",
    "path": "dark-mode-theme",
    "ref": "examples-v0.1.3"
  },
  "target": {
    "devices": ["xteink-x3", "xteink-x4"],
    "chipFamilies": ["esp32-c3"],
    "minFirmware": "0.1.0",
    "apiLevel": 1,
    "ramClass": "low",
    "requiresPSRAM": false
  },
  "integrity": {
    "sha256": "3c9f17747c9134ad20fbfcf562e098b730e4fcee4b0305f394f00b4e404a0387"
  },
  "artifact": {
    "url": "https://github.com/marginalia-os/marginalia-examples/releases/download/examples-v0.1.3/org.marginalia.examples.dark-mode-0.1.3.mpkg.zip",
    "format": "mpkg.zip",
    "size": 1643
  },
  "releasedAt": "2026-05-16T00:00:00Z",
  "updatedAt": "2026-05-16T00:00:00Z"
}
