{
  "$schema": "../schema/catalog-entry.v1.schema.json",
  "id": "org.marginalia.examples.hangman",
  "name": "Hangman",
  "version": "0.1.0",
  "kind": "app",
  "execution": "app",
  "channel": "experimental",
  "summary": "A simple standalone Hangman game",
  "author": "Marginalia",
  "homepage": "https://github.com/marginalia-os/marginalia-examples/tree/main/hangman-app",
  "source": {
    "type": "git",
    "url": "https://github.com/marginalia-os/marginalia-examples.git",
    "path": "hangman-app",
    "ref": "examples-v0.1.0"
  },
  "target": {
    "devices": ["xteink-x3", "xteink-x4"],
    "chipFamilies": ["esp32-c3"],
    "minFirmware": "0.1.0",
    "apiLevel": 1,
    "ramClass": "low",
    "requiresPSRAM": false
  },
  "integrity": {
    "sha256": "2d19a896634536f5e8dcc94a3927a445317cc266e6bcaccfb675667fea5f38b9"
  },
  "artifact": {
    "url": "https://github.com/marginalia-os/marginalia-examples/releases/download/examples-v0.1.0/org.marginalia.examples.hangman-0.1.0.mpkg.zip",
    "format": "mpkg.zip",
    "size": 1115
  },
  "releasedAt": "2026-05-15T00:00:00Z",
  "updatedAt": "2026-05-15T00:00:00Z"
}
